berita,tagging,judul_berita
"Kebersihan gigi merupakan faktor utama dalam menjaga kesehatan gigi dan mulut Anda diharuskan untuk membersihkan gigi menggunakan sikat gigi setidaknya dua kali sehari yakni usai makan dan sebelum tidur Waspada, Heboh Isu Sikat Gigi Yang Terbuat Dari Bulu Babi Baru-baru ini, beredar kabar yang cukup menghebohkan terkait sikat gigi Beberapa produk sikat gigi disebut menggunakan bulu babi sebagai bahan utamanya Salah satu akun di jejaring sosial Facebook mengunggah satu merek sikat dan menuliskan jika sikat gigi tersebut berasal dari bulu babi Bahkan, statusnya tersebut sudah dibagikan lebih dari 1000 kali oleh teman-temannya Akun dengan nama Hamirudin Hamzah mengatakan, jika ia ditegur kasir salah satu toko swalayan bahwa sikat gigi yang dibelinya mengandung bulu babi Di dalam komposisi sikat gigi tersebut ada kata Bristles, yang merupakan bulu salah satu binatang Namun ada akun bernama Mindy Chin, yang lebih menjelaskan apa itu bristles Ia menuliskan: Ini sangat lucu sekali Bristles adalah salah satu komposisi sikat gigi, tetapi tidak semuanya berasal dari babi, bisa saja dari hewan lainnya, Rabu (5/10/2016) Oleh karenanya, tidak semua sikat gigi yang kita gunakan berasal dari bulu babi Namun tetap, sebagai seorang muslim Anda perlu waspada dan memilih sikat gigi yang benar-benar halal",Valid,"Kebersihan gigi merupakan faktor utama dalam menjaga kesehatan gigi dan mulut Anda diharuskan untuk membersihkan gigi menggunakan sikat gigi setidaknya dua kali sehari yakni usai makan dan sebelum tidur Waspada, Heboh Isu Sikat Gigi Yang Terbuat Dari Bulu Babi Baru-baru ini, beredar kabar yang cukup menghebohkan terkait sikat gigi Beberapa produk sikat gigi disebut menggunakan bulu babi sebagai bahan utamanya Salah satu akun di jejaring sosial Facebook mengunggah satu merek sikat dan menuliskan jika sikat gigi tersebut berasal dari bulu babi Bahkan, statusnya tersebut sudah dibagikan lebih dari 1000 kali oleh teman-temannya Akun dengan nama Hamirudin Hamzah mengatakan, jika ia ditegur kasir salah satu toko swalayan bahwa sikat gigi yang dibelinya mengandung bulu babi Di dalam komposisi sikat gigi tersebut ada kata Bristles, yang merupakan bulu salah satu binatang Namun ada akun bernama Mindy Chin, yang lebih menjelaskan apa itu bristles Ia menuliskan: Ini sangat lucu sekali Bristles adalah salah satu komposisi sikat gigi, tetapi tidak semuanya berasal dari babi, bisa saja dari hewan lainnya, Rabu (5/10/2016) Oleh karenanya, tidak semua sikat gigi yang kita gunakan berasal dari bulu babi Namun tetap, sebagai seorang muslim Anda perlu waspada dan memilih sikat gigi yang benar-benar halal"
"BEREDAR informasi di dunia media sosial tentang sikat gigi berbahan dasar bulu babi sehingga menimbulkan kecemasan bagi para nitizen yang telah menerima pesan tersebut. Penjelasan tentang bahan dasar bulu babi yang digunakan sebagai bulu sikat gigi bermula dari kata bristle pada kemasan sebuah brand sikat gigi global.
Diketahui, pesan yang telah tersebar tersebut berbunyi: Jangan membeli sikat gigi yang ada tulisannya seperti di kemasan ini tepatnya Bristle yang diartikan dalam pesan tersebut adalah Pig Hair alias Bulu Babi! Jadi pereiksa kembali kemasan sikat gigi anda saat membeli.
Tak hanya pada sikat gigi, informasi tersebut juga menyarankan agar masyarakat memeriksa kuas pengoles roti. Yang dijelaskan, di kuas itu biasanya tertulis Bristle, Pure Bristle, 100% China Bristle.
Setelah dilakukan pengecekan melalui beberpa kamus online seperti : http://dictionary.cambridge.org/dictionary/english/bristle
http://www.merriam-webster.com/dictionary/bristle
http://www.oxforddictionaries.com/definition/english/bristle
http://www.thesaurus.com/browse/bristle
Arti kata ""Bristle"" adalah helaian yang halus/tipis dan kokoh/kuat. Sehingga perlu ditegaskan jika informasi yang beredar adalah Hoax atau tidak benar. Selain untuk memastikan apakah bulunya berasal dari bulu hewan atau bahan sintetis dengan cara sedikit membakarnya. 
Jika tercium bau rambut, bisa dipastikan bulu itu berasal dari hewan. Kalau dari bahan sintetis atau sabut kelapa, baunya akan berbeda. Perlu ditambahkan juga saat ini produsen dan konsumen sikat gigi modern sendiri lebih memilih sikat gigi berbahan nylon. ",Valid,BEREDAR informasi di dunia media sosial tentang sikat gigi berbahan dasar bulu babi sehingga menimbulkan kecemasan bagi para nitizen yang telah menerima pesan tersebut.
"Masyarakat dihebohkan oleh produk sikat gigi yang menggunakan bulu babi sebagai bahan dasar yang digunakan untuk membersihkan gigi kita sehari-hari. 
Penggunaan produk itu merujuk tulisan dalam bahasa inggris yakni bristles pada kemasannya.
Seperti yang diterangkan situs Wikipedia produk bristles didapatkan dari turunan babi berupa bulu.

Bulu ini kerap digunakan oleh industri sebagai alat pembersih gigi, sikat toilet alat pembersih rumah tangga.
Penggunaan bagian tubuh babi termasuk bulunya ternyata diharamkan dalam Islam. 

Seperti yang diutarakan oleh Ketua MUI Kota Medan, Muhammad Hatta mengatakan, jika benar sikat gigi tersebut terbuat dari bulu babi, sikat gigi tersebut haram.
""Dalam Al Surah Surah Al Maidah ayat 3 dijelaskan turunan dari babi itu haram. Keharaman ini akan kita telusuri, benar-benar dari bulu babi atau tidak,"" katanya via seluler, Senin (7/3/2016)
Dia menambahkan, jika terbukti MUI akan publikasi kepada masyarakat agar tidak mengunakan sikat gigi tersebut. Selain itu, MUI akan menarik produk tersebut dari pasar.
Berbekal informasi inilah Tribun kemudian menelusuri kebenaran penggunaan bulu babi pada produk pembersih gigi.
Seperti yang terdapat pada minimarket di Jalan Denai, sikat gigi bermerek Or** * jelas-jelas terbuat dari bristles. 
Pada kemasan produk tersebut jelas menerangkan produknya, ""Super thin Bristles"".

Sementara itu, terkait hal ini Dinas Kesehatan Kota Medan melalui Sekretaris Dinas Kesehatan Sumut, Afwan Lubis tidak yakin dengan adanya sikat gigi terbuat dari bulu babi.
""Saya rasa tidak mungkinlah. Tapi gimana ya? Kami bisa komentar kalau ada uji labolatorium dulu. Saat ini belum ada uji labolatorium,"" katanya via seluler, Senin (7/3/2016)
Dia menambahkan, uji labolatorium dilakukan jika ada laporan dari masyarakat mengenai sikat gigi bulu babi tersebut. Jika benar mengandung bulu babi, maka tidak boleh beredar karena ada unsur tidak halalnya.",Valid,"Masyarakat dihebohkan oleh produk sikat gigi yang menggunakan bulu babi sebagai bahan dasar yang digunakan untuk membersihkan gigi kita sehari-hari. 
"
"Pesan berantai tentang kewaspadaan terhadap sikat gigi berbahan bulu babi merebak di masyarakat. karena ada kata bristle pada kemasan sebuah brand sikat gigi global. Pesan itu sebenarnya bukan barang baru. Pesan tersebut pernah tersebar setahun lalu, tapi kini ramai lagi Ayo cek sikat giginya, bila ada tulisan Bristle pada kemasan, maka berarti sikat gigi tersebut mengandung bulu Babi. Bristle berarti pig hair alias bulu babi. Begitu bunyi penggalan pesan yang kembali tersebar lewat aplikasi chatting. Tak hanya pada sikat gigi, pembuat pesan juga menyarankan agar masyarakat memeriksa kuas pengoles roti. Katanya, di kuas itu biasanya tertulis Bristle, Pure Bristle, 100% China Bristle. Seperti pada pesan-pesan hoaks lainnya, imbauan itu disertai permintaan untuk membagikan pesan tersebut kepada keluarga dan teman di grup agar lebih banyak orang yang terhindar dari produk tidak halal. Ternyata si penyebar informasi itu salah paham. Mungkin, ketika menulis pesan tersebut, dia belum ngopi. Sebab, istilah bristle tidak hanya digunakan untuk bulu babi Menurut situs resmi Lembaga Kajian Pangan Obat-obatan dan Kosmetika Majelis Ulama Indonesia (MUI), istilah bristle secara leksikal adalah a short, stiff hair, dan fiber. Jadi, semua serat rambut yang kaku bisa disebut bristle. Di dunia industri, bristle memang digunakan untuk bahan pembuat kuas atau sikat (termasuk sikat gigi). Namun, tidak semua berasal dari bulu babi. Bristle untuk kuas dan sikat bisa bersumber dari bulu hewan. Baik babi, kambing, kuda, maupun unta. Selain dari bulu hewan, untuk keperluan industri, bristle juga bisa berasal dari bahan sintetis, baik nilon maupun silikon. Serat tanaman juga pernah digunakan sebagai bahan kuas atau sikat. Serat itu biasa dikenal dengan ijuk. MUI memang tegas menyatakan, jika kuas atau sikat menggunakan bahan bulu babi, haram hukumnya Tapi, biasanya produsen menuliskan dengan detail bahan baku bulu yang digunakan. Biasanya, untuk sikat atau kuas dengan bahan bulu babi, ditulis boar bristle brush. Boar sendiri merupakan istilah bahasa Inggris yang merujuk pada babi hutan. Mengenali bahan baku kuas atau sikat gigi memang tidak mudah. Namun, Anda bisa memastikan apakah bulunya berasal dari bulu hewan atau bahan sintetis dengan cara sedikit membakarnya. Jika tercium bau rambut, bisa dipastikan bulu itu berasal dari hewan. Kalau dari bahan sintetis atau sabut kelapa, baunya akan berbeda. Merujuk pada sejumlah sumber, penggunaan bulu pada sikat gigi kali pertama dilakukan orang Tiongkok pada abad ke-15. saat itu digunakan bulu yang terdapat pada leher babi. Sikat itu kemudian dibawa ke pasar Eropa. Tapi, orang Eropa lebih senang dengan bulu kuda karena lebih lembut. Sikat gigi modern pertama dikenalkan William Addis di Inggris sekitar 1780 Pegangannya diukir dari tulang sapi. Dan, bagian bulunya masih terbuat dari bulu babi, bentuknya hanya satu baris besar. Selanjutnya, pada 1844, dirancang sikat gigi dengan bulu sebanyak tiga baris. Teknologi modern pun akhirnya menemukan nilon bisa dijadikan bulu pada sikat. Teknologi tersebut diperkenalkan pada 1938. Sejak 1950, industri sikat gigi lebih banyak menggunakan bulu dari nilon.Jadi, jangan buru-buru menganggap tulisan bristle dalam kemasan sikat gigi Anda sebagai bulu babi.",Valid,Pesan berantai tentang kewaspadaan terhadap sikat gigi berbahan bulu babi merebak di masyarakat .
"Beberapa waktu lalu media sosial diramaikan oleh status yang dibagikan seorang nitizen tentang sikat gigi yang diduga dari bulu babi. Yang menjadi perhatian netizen tersebut adalah adanya tulisan bristle di kemasan sikat gigi yang kontan membuat netizen bertanya benarkah sikat gigi tersebut tidak dapat dikatakan sebagai produk halal???
Hal ini bermula dari artikel tentang kuas bulu babi yang beredar sebelumnya, dapat dilihat di situs LPPOM MUI :

Artikel tersebut menyatakan bahwa pada gagang kuas berbulu babi sering tertulis kata : Bristle, PureBristle, 100% China Bristle, dan lain-lain. SALAH SATU makna kata Bristle adalah Pig Hair atau bulu babi (Websters Dictionary) yang berstatus najis apabila basah.

Penggunaan kata SALAH SATU dalam artikel tersebut ternyata salah dipahami sebagian netizen yang menyamaratakan pengertian bristle dengan bulu babi. Padahal apabila kita telusuri lebih lanjut, pengertian bristle itu jauh lebih umum dari sekedar bulu babi. Bristle merupakan serat atau bulu kaku/kuat, baik alami yang berasal dari serat tumbuhan dan rambut binatang atau buatan (sintetis). Dari definisi tersebut maka kata bristle pada kemasan sikat gigi tidak serta merta menjadikan sikat gigi tersebut berasal dari bulu babi. Hal ini berarti sikat gigi tersebut bisa saja berasal dari bulu hewan yang lain, serat tumbuhan atau bahkan dari bulu sintetis.

Apabila kita melihat kembali sejarah dan perkembangan sikat gigi, bulu sikat yang terdapat pada sikat gigi awalnya memang berasal dari bulu babi hutan (Siberia). Namun seiring perkembangan teknologi, pada tahun 1938 sikat gigi sudah mulai diproduksi dengan bulu sikat berbahan nilon yang tetap mendominasi hingga saat ini. Meskipun demikian tidak bisa dipungkiri masih ada sekitar 10% di seluruh dunia produk sikat gigi yang bulu sikatnya berasal dari bulu babi.

Setelah kita memahami definisi bristle yang sesungguhya, lantas bagaimana cara kita mengetahui apakah sikat gigi tersebut berasal dari serat/bulu yang tidak halal? Cara sederhana adalah mencari keterangan di situs resmi produsen sikat gigi tersebut, atau bahkan menanyakan langsung ke pusat layanan konsumen.

Arus informasi di media sosial yang sangat pesat menjadikan kita harus lebih berhati-hati dalam menyebarkan informasi. Apabila kita belum bisa menemukan informasi valid, alangkah baiknya informasi tersebut ditanyakan di forum yang memang berkaitan dengan informasi tersebut. Info mengenai kehalalan suatu produk, tentunya tidak hanya makanan/minuman/kosmetik tetapi juga gaya hidup dan pemikiran, menjadi bagian yang sangat penting dalam kehidupan seorang muslim karena berimbas pada urusan ibadah dan akhirat. Sejatinya urusan halal dan haram bukan hanya tanggung jawab MUI atau pemerintah melainkan urusan kita sebagai umat muslim,.

Oleh karena itu, Halal Corner mengajak kaum muslimin/muslimah untuk bergabung dengan komunitas pejuang halal. Halal Corner merupakansebuah komunitas yang didirikan sebagai wadah untuk berkomunikasi aktif / sharing mengenai berbagai produk halal khususnya di daerah setempat serta memberikan penyuluhan dan pendidikan halal bagi kaum muslim dalam bentuk pelatihan, kampanye halal, serta kegiatan-kegiatan edukatif yang membangun kesadaran masyarakat akan pentingnya produk hala6l.

Mari jadikan halal bagian dari hidup kita.",Valid,Beberapa waktu lalu media sosial diramaikan oleh status yang dibagikan seorang nitizen tentang sikat gigi yang diduga dari bulu babi .
"Badan Narkotika Nasional (BNN) telah merampungkan proses pemeriksaan laboratorium terhadap permen dot yang diduga mengandung zat narkoba.  Berdasarkan hasil pemeriksaan itu, BNN menyatakan, permen dot tidak mengandung narkoba.
""Setelah dilakukan pengujian di Balai Laboratorium Narkoba BNN disimpulkan bahwa sampel permen tersebut negatif, atau tidak mengandung narkotika atau juga bahan psikoaktif lainnya,"" kata Kepala Bagian Humas BNN, Kombes Pol Slamet Pribadi kepada VIVA.co.id, Kamis, 9 Maret 2017.
Slamet mengatakan, selain uji laboratorium, hal lainnya yang memperkuat bahwa permen dot tak mengandung narkoba, yaitu peredarannya yang melalui jalur resmi dan telah mendapat izin edar resmi.
""Beberapa kasus jenis makanan sering dijadikan modus para sindikat narkotika. Namun biasanya produk-produk tersebut dijual secara ilegal dan dengan harga yang tentunya berbeda dari harga pasar,"" ujarnya
Meski begitu, BNN tetap meminta para orang tua untuk selalu mengawasi pergaulan putra putrinya. Begitu juga dengan pihak terkait lain, seperti sekolah, lingkungan RT, lingkungan RW, hingga tokoh agama, tokoh masyarakat, tokoh adat, tokoh pemuda untuk dapat turut membantu mengawasi lingkungan sekitar, agar terhindar dari bahaya penyalahgunaan narkoba
""BNN mengimbau kepada masyarakat agar tetap waspada terhadap berbagai modus peredaran gelap Narkoba yang semakin beragam,"" ujarnya.
Seperti diberitakan sebelumnya, permen dot dalam kemasan botol diduga mengandung narkoba beredar di Kota Surabaya. Permen dot tersebut ditemukan Satuan Polisi Pamong Praja (Satpol PP) Kota Surabaya, saat menggelar razia di 14 kecamatan. Razia digelar setelah ada murid Sekolah Dasar (SD) yang mengalami pusing setelah memakan permen itu. 
Tak hanya di Surabaya, permen dot juga telah beredar di sejumlah kota lain seperti Mojokerto dan
Bekasi, Jawa Barat.",Valid,Badan Narkotika Nasional (BNN) telah merampungkan proses pemeriksaan laboratorium terhadap permen dot yang diduga mengandung zat narkoba.  
"beredarnya permen diduga mengandung bahan berbahaya bagi anak-anak, dirazia POl PP bersama timlainnya di 14 kecamatan Di Surabaya, Selasa (7/3/2017).

Tim gabungan yang terdiri dari Satpol PP, petugas Puskesmas, Polsek dan Koramil merazia di lapak-lapak pedagang jajanan dan makanan kecil mencari permen tersebut.

Dikutip dari suarasurabaya.net, Irvan Widyanto Kepala Satuan Polisi Pamong Praja (Kasatpol PP) Kota Surabaya menyampaikan bahwa dari temuan jajanan permen yang dijual pedagang makanan di dekat sebuah sekolah dasar di kawasan Peneleh pada kemasannya dipastikan memiliki izin edar.

""Dari 3 jenis permen yang dirazia (permen Keras, permen di kemasan botol dot dan permen berbentuk domba) pada masing-masing kemasannya dilengkapi izin edar, tetapi diduga izin edarnya palsu,"" kata Irvan Widyanto kepada wartawan yang menemuinya.

Dari temuan di lapangan, kemasan jajanan permen dalam botol dot dilengkapi izin edar ML 224409003077. Tulisan yang terdapat pada izin edar itu mengindikasikan jenis makanan dari luar negeri dan diproduksi oleh Xiamen Yang Wan Foodstuff, Cina.

Sedangkan untuk jajanan permen dengan merek produk Permen Keras, dan merek Penguin, diimpor oleh PT. Petrona Inti Chemindo, Jakarta Barat, DKI Jakarta, dengan masa berlaku izin edar sampai 19-08-2018.

Irvan menambahkan bahwa pengamanan terhadap ratusan jajanan permen tersebut, selanjutnya oleh pihak Satpol PP akan diserahkan kepada Dinas Kesehatan (Dinkes) Kota Surabaya untuk dilakukan uji laboratorium di Balai Besar POM Surabaya.

""Kami ingin mengetahui kandungan bahan berbahaya yang ada didalamnya. Butuh waktu kurang lebih 1 minggu. Selanjutnya razia dan pengamanan yang memang sudah kami mulai gelar Senin (6/3/2017) akan kami lanjutkan sampai pada 31 kecamatan di seluruh Surabaya,"" ujar Irvan Widyanto.

Sementara itu, dari hazil pengamanan di sekitar 5 lapak pedagang dan 1 grosir jajanan anak-anak di Kecamatan Wonokromo, Selasa (7/3/2017) ditemukan 340 botol permen dengan merek Permen Keras yang termasuk kategori harus diamankan.(ss/j1)",Hoax,"beredarnya permen diduga mengandung bahan berbahaya bagi anak-anak, dirazia POl PP bersama timlainnya di 14 kecamatan Di Surabaya, Selasa (7/3/2017).

"
"Saat ini sedang beredar pemberitaan terkait permen berbentuk dot yang beredar di Surabaya, Jawa Timur, yang diduga mengandung Narkoba atau bahan berbahaya lainnya.
Permen yang diketahui diimpor dari negara tertentu ini viral di media sosial karena dituding mengandung Narkoba.
Badan Narkotika Nasional (BNN) sebagai focal point permasalahan Narkoba di Indonesia, menyampaikan bahwa sampai dengan saat ini BNN Provinsi Jawa Timur dan BNN Kota Surabaya tengah membawa sample permen tersebut untuk dilakukan pemeriksaan secara ilmiah oleh Balai Laboratorium Narkoba BNN terkait kandungan permen.
BNN menghimbau agar masyarakat bersabar menunggu hasil pemeriksaan tersebut.
Diharapkan para orang tua dan anak-anak tetap WASPADA terhadap segala macam bentuk dan jenis Narkoba dengan tidak mengonsumsi makanan, minuman, maupun obat-obatan yang tidak memiliki ijin edar.",Valid,"Saat ini sedang beredar pemberitaan terkait permen berbentuk dot yang beredar di Surabaya, Jawa Timur, yang diduga mengandung Narkoba atau bahan berbahaya lainnya.
"
"Maraknya peredaran permen ""DOT"" yang diduga mengandung narkoba ternyata sempat beredar di Kota Depok.
Bahkan peredaran permen dengan wadah menyerupai botol susu bayi ini pernah beredar di sejumlah sekolah.
Salah satu siswa SD di kawasan Sukmajaya, YZ mengaku pernah beberapa kali membeli permen yang tersebut, sebelum akhirnya dilarang.
""Bentuknya kaya dot, rasanya manis, di dalam botolnya itu ada serbuk rasa asemnya,"" kata YZ kepada Radar Depok (Pojoksatu.id Group), Jumat (10/03/2017).
YZ melanjutkan, permen biasa dijual penjual asesoris dengan gerobak. Tetapi, saat ini pedagang tersebut sudah tak terlihat di sekolah.
""Biasanya dijual sama abang-abang jepitan gitu, sekarang udah gak ada. Udah lama juga gak liat. Terakhir kelas IV, kira-kira setahun lalu lah,"" kata YZ.
Siswa lainnya berinisial DM mengaku pernah mencoba permen 'Dot'. Permen di bagian atas yang berwarna merah serta perpaduan serbuk berwarna orange, pink dan putih, membuatnya tertarik untuk membeli permen.
""Pernah coba, jadi di dalam botolnya itu ada bubuknya, trus yang buat ngempeng itu permennya warna merah. Kalau dicampur semuanya jadi asem gitu tapi gak bikin nagih sih, biasa aja. Biasanya juga ada di tukang jepitan, di agen-agen juga ada, aku pernah lihat,"" ujar DM kepada Radar Depok (Pojoksatu.id Group).
Sementara itu, Yadi salah satu penjaga kantin sekolah mengungkapkan bahwa dirinya pernah berjualan permen 'DOT'.
Kendati saat ini sudah dilarang karena diindikasi mengandung narkoba, dirinya sudah tak lagi berjualan permen tersebut.
""Tahun kemarin sih saya jualan, sekarang udah enggak jualan lagi, kan katanya di berita udah gak boleh jadi saya udah gak jualan lagi. Ada aja sih anak-anak yang beli. Waktu itu banyak yang nyari juga, tapi sekarang mungkin udah lupa ya,"" ujarnya.
Tak hanya di sekolah, bahkan permen ini sempat dijual agen makanan di sekitar Depok.
Ditemui terpisah, salah satu agen makanan di daerah Tapos berinisial T mengatakan tokonya pernah menjual permen 'DOT'. Namun, saat ini tokonya sudah tidak menjualnya lagi.",Valid,"Maraknya peredaran permen ""DOT"" yang diduga mengandung narkoba ternyata sempat beredar di Kota Depok.
"
"Bupati Lebak Iti Octavia Jayabaya mengimbau agar masyarakat mengawasi anak-anaknya dalam membeli jajanan ringan, khususnya permen berbentuk dot. Sebab, permen tersebut diduga mengandung zat berbahaya dan perdaraannnya saat ini sudah mulai meluas di Lebak.

""Para orang tua harus ikut mengawasi anaknya, jangan sampai sembarangan dalam membeli jajanan. Apalagi, kita mendengar ada jajanan permen yang mengandung zat berbahaya,"" kata Iti, Kamis (9/3/2017).

Sebagai langkah antisipasi beredarnya permen tersebut, kata Iti, pihaknya akan menarik perederan permen itu dipasaran. Pihaknya juga akan melakukan uji laboratorium mengecek zat yang terkandung dalam permen tersebut.

""Kita akan uji laboratorium dulu. Jika ada kandungan zat berbahaya, apalagi narkoba, kita akan tarik peredarannya. Sebab, peremen itu pasarnya banyak dari kalangan anak-anak,"" katanya.

Sementara, Kepala Dinas Perindustrian dan Perdagangan Lebak, Hari Setiono mengatakan, pihaknya telah menyebarkan pemberitahuan kepada masyarakat agar waspada terhadap permen yang beredar tanpa lebel yang jelas, khususnya permen diduga mengandung narkoba yang saat ini beredar dipasaran.
""Kami terus melakukan pengawasan agar permen tersebut tidak lagi beredar di Lebak,"" ujarnya",Valid,"Bupati Lebak Iti Octavia Jayabaya mengimbau agar masyarakat mengawasi anak-anaknya dalam membeli jajanan ringan, khususnya permen berbentuk dot."
"Razia permen dot yang terindikasi narkoba terus dilakukan oleh pemerintah Kota Surabaya.Ada tiga titik kecamatan yang digerakkan oleh Satpol PP Kota Surabaya untuk dilakukan razia permen berkemasan warna hijau tersebut.

Yaitu Kecamatan Genteng, Kecamatan Rungkut dan Kecamatan Sawahan.Camat Sawahan Kota Surabaya Yunus mengatakan razia sudah dilakukan ke tiga titik sekolah.

""Kita razia di SDN Pakis I, II, dan IX di Jalan Pakistirtosari. Hasilnya ada 20 biji permen dot,"" ucap Yunus.

Permen dot tersebut disinyalir memiliki kandungan narkoba.Secara fisik permen tersebut tidak terlihat seperti narkoba melainkan seperti permen biasa.

""Yang jual di PKL sekitar sekolah, dan langsung diamankan. Kita amankan dan dibawa ke kantor kecamatan,"" ucap Yunus.

Tidak hanya permen dot, namun dalam razia makanan dan minuman di sejumlah SD di Sawahan itu juga ditemukan sejumlah permen keras.Yaitu permen yang mengandung formalin yang berbahaya jika dikonsumsi oleh anak.

""Untuk permen keras ada 33 biji dan 17 pack permen keras yang bentuknya tablet. Itu juga kita amankan,"" kata Yunus",Hoax,Razia permen dot yang terindikasi narkoba terus dilakukan oleh pemerintah Kota Surabaya.
"Saat ini sedang beredar pemberitaan terkait permen yang berbentuk dot yang beredar di Kota Surabaya, Jawa Timur. Yang diduga mengandung Narkoba atau bahan berbahaya yang lainnya.
Permen yang diketahui diimpor dari negara tertentu ini viral di media sosial karena dituding mengandung narkoba.
Dalam surat imbauan bernomor B/HB-01/III/2017/Humas tertanggal 8 Maret 2017, BNN mengimbau masyarakat untuk waspada terhadap segala macam bentuk narkoba dan tidak mengonsumsi makanan, minuman, atau obat-obatan yang tidak memiliki izin edar.
Badan Narkotika Nasional (BNN) sebagai focal point permasalahan narkoba di Indonesia, menyampaikan bahwa sampai saat ini BNN Jawa Timur tengah membawa sample permen tersebut untuk dilakukan pemeriksaaan secara ilmiah oleh Balai Labolatorium Narkoba terkait kandungan narkoba.
BNN menghimbau agar masyarakat bersabar menunggu hasil pemeriksaan tersebut.
Diharapkan agar para orang tua dan anak anak waspada terhadap segala macam bentuk dan jenis narkoba dengan tidak mengkonsumsi makanan, minuman maupun obat-obatan yang tidak memiliki ijin edar",Valid,"Saat ini sedang beredar pemberitaan terkait permen yang berbentuk dot yang beredar di Kota Surabaya, Jawa Timur."
