berita,tagging,judul_berita
"Produk permen berbentuk dot telah mengantongi izin produksi dari Badan Pengawas Obat dan Makanan (BPOM). Ya, benar (sudah mengantongi izin), kata Kepala Pusat Penyidikan Obat dan Makanan BPOM Hendri Siswadi, saat dihubungi di Jakarta, Kamis, 9 Maret 2017. 
Permen berbentuk dot yang diduga mengandung narkoba tersebut ditemukan di Surabaya, Jawa Timur. BPOM Surabaya tengah memeriksa kandungan permen yang diduga mengandung narkoba. Namun, hasil sementara, kata Hendri, kandungan bahan berbahaya belum ditemukan. Sampai hari ini, BPOM Surabaya sudah menguji menggunakan 16 parameter dengan hasil negatif.
Temuan permen diduga mengandung narkoba itu bermula dari operasi rutin Satuan Polisi Pamong Praja saat merazia pelajar yang membolos saat jam sekolah di Surabaya. Salah satunya di warung Internet yang biasa dijadikan tempat nongkrong siswa ketika membolos. 
Dalam operasi itu tim menemukan seorang siswa SD yang merasa pusing setelah mengkonsumsi permen. Kepala Satuan Polisi Pamong Praja Irvan Widianto mengatakan ada beberapa bentuk permen narkoba berbentuk dot bayi bermerek Permen Keras dan tongkat jeli.
Kepolisian juga memeriksa temuan permen itu. Kemarin, Kepala Bagian Penerangan Umum Divisi Humas Polri Komisaris Besar Martinus Sitompul mengatakan sedang menunggu uji laboratorium forensik Badan Narkotika Nasional Kota Surabaya.",Valid,Produk permen berbentuk dot telah mengantongi izin produksi dari Badan Pengawas Obat dan Makanan (BPOM).
"Kepala BPOM RI Penny Kusumastuti Lukito menegaskan, permen dot negatif narkoba dan tidak mengandung zat berbahaya lainnya. Kepastian ini diperoleh setelah melakukan serangkaian pemeriksaan terhadap permen tersebut.

""Setelah dites dan selidiki menggunakan 12 parameter penentu, tidak ditemukan kandungan narkoba dan kandungan makanan berbahaya lainnya. Berarti tidak ada pelarangan penjualan permen yang sebarannya sudah hampir di seluruh indonesia ini,"" kata Peny di sela-sela acara Munas BPOM Nasional di Hotel Singhasari, Kota Batu, Jawa Timur, Kamis (9/3/2017).

Dia menjelaskan, isu permen dot mengandung narkoba menjadi ramai setelah ada laporan seorang warga dari Surabaya. Disebutkan ada seorang anak yang mengonsumsi permen dot mengalami pusing-pusing dan ketagihan. ""Kami juga meminta media memberikan informasi yang benar kepada masyarakat,"" pungkasnya",Valid,"Kepala BPOM RI Penny Kusumastuti Lukito menegaskan, permen dot negatif narkoba dan tidak mengandung zat berbahaya lainnya."
"Badan Pengawas Obat dan Makanan (BPOM) menyatakan permen merk 'Penguin Brand' atau permen dot bebas kandungan narkoba dan psikotropika. Kepala BPOM Penny Kusumastuti Lukito dalam konferensi pers pada Kamis (9/3) mengungkapkan uji laboratorium telah dilakukan pada permen tersebut. 
Ia mengatakan dari 12 parameter yang diuji, semuanya menunjukkan hasil negatif. ""Kami sudah koordinasi dengan Badan Narkotika Nasional dan hari ini disimpulkan bahwa permen dot tidak mengandung narkotika,"" demikian penjelasan Penny di sela Munas BPOM 2017 di Batu. 
Pengujian terhadap permen dot dilakukan di BPOM Surabaya sebagai tempat ditemukannya jajanan tersebut. Selain di Surabaya, uji permen dot juga dilakukan di BPOM Bandar Lampung dan Serang. Seluruhnya menunjukkan hasil negatif narkotika. 
Penny menambahkan pengujian kandungan rhodamin B dan formalin pada permen dot juga menunjukkan hasil negatif. Hasil negatif menandakan permen tersebut masih bisa beredar dan dikonsumsi. ""Kami minta masyarakat tenang namun tetap waspada mengonsumsi makanan apa pun karena bisa saja terkontaminasi atau dikontaminasi,"" imbuhnya. 
Berdasarkan penelitian BPOM, permen dot telah mengantongi izin edar yang akan berakhir pada 2018 mendatang. Permen impor dari Cina itu banyak diperjualbelikan di lingkungan sekolah Surabaya. Meski demikian Penny menginstruksikan kepada seluruh BPOM di daerah untuk ikut mengecek produk yang dimaksud. 
Pemerintah Surabaya melalui seluruh jajarannya merazia permen dot di sejumlah sekolah dan pasar. Isu permen dot mengandung narkotika santer berhembus di media massa dan media sosial sejak 6 Maret silam. Isu ini mencuat setelah Pemkot Surabaya mencurigai adanya kandungan rhodamin-B dan formalin. ",Valid,Badan Pengawas Obat dan Makanan (BPOM) menyatakan permen merk 'Penguin Brand' atau permen dot bebas kandungan narkoba dan psikotropika.
"Sebanyak 345 permen dot yang disita petugas Satpol PP Pemkot Surabaya dalam razia pedagangan jajanan beberapa waktu lalu, dikembalikan ke pemiliknya. Ini menyusul pengumuman yang dikeluarkan BPOM bahwa permen tersebut negatif narkoba.
Kabag Humas Pemkot Surabaya Muhammad Fikser mengatakan, saat melakukan razia beberapa waktu lalu, petugas Satpol PP mendata nama-nama penjual beserta jumlah permen yang disita, sehingga proses pengembalian barang sitaan akan berjalan mudah.
""Dikembalikan ke pedagang karena memang tidak mengandung bahan-bahan berbahaya. Satpol PP saat razia ada datanya. Siapa penjualnya dan berapa jumlah barang yang disita,"" kata Fikser saat dikonfirmasi Okezone, Jumat (10/3/2017).
Satpol PP juga akan mengembalikan permen-permen yang disita dari beberapa kelurahan. Seperti diketahui, ada 14 kecamatan yang merupakan lokasi penyebaran permen dot di Surabaya. Penjual paling banyak di sekitaran Sekolah Dasar (SD) dan Taman Kanak-kanak (TK).
Fikser menerangkan, dari hasil pemeriksaan Dinas Kesehatan Surabaya, permen dot hanya mengandung perwarna. ""Untuk permen dot memang ada kandungan perwarna tapi tidak berbahaya,"" tegasnya.
Pengembalian permen akan dimulai besok. ""Kasihan para pedagang jika disita. Mereka juga beli untuk jual lagi,"" tambahnya.",Valid,"Sebanyak 345 permen dot yang disita petugas Satpol PP Pemkot Surabaya dalam razia pedagangan jajanan beberapa waktu lalu, dikembalikan ke pemiliknya."
"Warga Surabaya boleh bernafas lega setelah Balai Besar Pengawas Obat dan Makanan (BBPOM) menyatakan permen berbentuk dot yang diduga mengandung narkoba ternyata hasilnya negatif.
Kepala Seksi Layanan Informasi Konsumen BBPOM Surabaya, Lindawati mengatakan berdasarkan hasil uji lab atas sampel yang dikirim oleh dinkes Surabaya berbentuk permen dot yang dilakukan oleh pihaknya ditemukan bahwa hasilnya adalah negatif dari kandungan zat narkoba.
""Hasil uji laboratorium kami terhadap sampel yang dikirimkan oleh pihak dinkes surabaya hanya untuk permen yang berbentuk dot, dan hasilnya adalah negatif "" ujar Lindawati saat hearing dengan Komisi D DPRD Kota Surabaya bersama Dinkes, BNNK Surabaya, Satpol PP dan Dinas Pendidikan, Kamis (09/03/2017)).
Lebih lanjut, Lindawati juga menjelaskan bahwa berdasarkan data dari pihaknya bahwa permen tersebut telah memiliki ijin edar dari BBPOM dan legal.
""Untuk hasilnya sudah kami umumkan diwebsite kami www.pom.go.id masyarakat bisa melihat informasi tersebut disana,"" paparnya.
Meski begitu, pihaknya menghimbau kepada masyarakat untuk menjadi konsumen yang cerdas dengan melakukan cek terhadap makanan yang akan dikonsumsi.
""Kami sudah melakukan pengawasan terhadap produk dan pengawasan terhadap cara produksi dan iklan dan label. Selanjutnya masyarakat sendiri yang harus cerdas sebagai konsumen,"" imbuhnya.
Sementara itu, dari pihak satpol PP kota Surabaya mengaku sudah mengamankan sekitar 1496 permen dari berbagai jenis yang didapat selama gelaran operasi selama tiga hari diberbagai wilayah kecamatan di Surabaya.
""Berdasarkan hasil operasi selama tiga hari kami mendapatkan sekitar 1496 permen yang kami sita diberbagai sekolah baik di sekolah dasar (SD) dan Taman Kanak-kanak (TK) diberbagai wilayah di Surabaya"" ujar Kasi Pengawasan Satpol PP Surabaya, Saiful Ikhsan.
Saiful juga mengatakan bahwa jika memang hasil uji lab negatif pihaknya juga siap mengembalikan permen yang telah diamankan oleh Satpol PP. Berdasarkan data terbaru dari laporan pihak kecamatan Wonokromo, juga sudah ditemukan agen dari permen tersebut.
""Jika memang hasilnya negatif kami siap mengembalikan permen yang sudah kami ambil karena sudah terdata siapa pemiliknya,"" imbuhya.@wan",Valid,"Warga Surabaya boleh bernafas lega setelah Balai Besar Pengawas Obat dan Makanan (BBPOM) menyatakan permen berbentuk dot yang diduga mengandung narkoba ternyata hasilnya negatif.
"
"Permen berbentuk dot susu atau permen keras yang dicurigai mengandung narkotika telah selesai diuji laboratorium Balai Besar Pengawas Obat dan Makanan (BBPOM) Kota Surabaya. Hasilnya, permen tersebut negatif narkotika.

Pelaksana Tugas BBPOM Kota Surabaya, Retno Kurpaningsih, mengatakan, ada 16 item yang diujikan untuk mengetahui ada tidaknya kandungan zat adiktif. Hasilnya menunjukkan negatif semua.
""Kami uji ada tidak kandungan amfetamin dan metamfitamin,"" katanya, di Surabaya, Kamis, 9 Maret 2017.

Kepada masyarakat, Retno mengatakan, permen keras uang dirazia Satpol PP pada Senin 7 Maret 2017 lalu itu tidak berbahaya. BBPOM Jumat, 10 Maret akan menyerahkan hasil uji laboratorium ini kepada Dinas Kesehatan Kota Surabaya sebagai pemohon uji laboratorium.

Diinformasikan juga, ada siswa yang setelah mengkonsumsi permen keras mengalami batuk dan serik di tenggorokan. Namun Retno masih belum mengetahui temuan baru itu.

""Saya belum tahu. Sementara yang kami tahu ada satu siswa setelah mengonsumsi merasakan pusing. Nanti akan kami telusuri lagi,"" katanya.

Retno berjanji akan menelusuri lagi dan akan melakukan uji laboratorium meski telah ada sampel yang telah selesai diujikan. Sayangnya, Retno belum memberitahu apa saja yang akan ditelusuri selanjutnya.

Satpol PP merazia permen susu dot atau permen keras di sekitar SD dan TK di 14 kecamatan di Kota Surabaya. Langkah penyitaan itu dilakukan setelah petigas menemukan satu anak siswa SD yang merasa pusing setelah mengonsumsi permen keras.",Valid,Permen berbentuk dot susu atau permen keras yang dicurigai mengandung narkotika telah selesai diuji laboratorium Balai Besar Pengawas Obat dan Makanan (BBPOM) Kota Surabaya.
"Balai Besar Pengawasan Obat dan Makanan (BBPOM) memastikan, produk permen diduga mengandung narkoba yang beredar di Surabaya aman dikonsumsi. Hasil uji laboratorium menyebutkan, dari 16 indikasi kandungan yang diuji, menunjukkan negatif narkoba. ""Seperti metaphetamine, dan amphetamine, semunya negatif, alias permen tersebut bebas narkoba,"" kata Plt Kepala BBPOM Surabaya, Retno Kurpaningsih, Kamis (9/3/2017). Hasil uji laboratorium tersebut, secepatnya akan dikirim ke Dinas Kesehatan Kota Surabaya sebagai pemohon uji. ""Yang pasti kami merekomendasikan permen dimaksud aman dikonsumsi,"" jelasnya. Jika BBPOM Surabaya memastikan bahwa permen tersebut negatif, Badan Nasional Narkotika (BNN) Surabaya mengaku belum merilis hasil uji laboratorium atas permen yang dimaksud. nanti yang mengumumkan hasilnya langsung Kepala BNN, Komjen Budi Waseso,"" kata Kepala BNN Surabaya, AKBP Suparti. Seperti diberitakan, produk permen bermerek Permen Keras yang dijual di sekitar sekolah oleh toko maupun pedagang asongan dirazia Satpol PP awal pekan lalu karena diduga mengandung narkoba. Kemasan permen tersebut berwarna warni dan beragam bentuknya. Ada yang seperti permen biasa, dan ada kemasan yang berbentuk dot bayi. Dalam razia Senin (6/3/2017) di 14 kecamatan, petugas Satpol PP menyita 345 botol permen diduga mengandung narkoba.",Valid,"Balai Besar Pengawasan Obat dan Makanan (BBPOM) memastikan, produk permen diduga mengandung narkoba yang beredar di Surabaya aman dikonsumsi."
"Badan Narkotika Nasional (BNN) mengimbau warga untuk mewaspadai peredaran permen berbentuk dot di Surabaya, Jawa Timur yang diduga mengandung narkoba atau bahan berbahaya lain. Permen yang diketahui diimpor dari negara tertentu ini, diketahui menjadi viral di media sosial karena dituding mengandung narkoba. ""Badan Narkotika Nasional (BNN) sebagai vocal poin permasalahan narkoba di Indonesia, menyampaikan bahwa sampai dengan saat ini BNN Provinsi Jawa Timur dan BNN Kota Surabaya tengah membawa sample permen tersebut untuk dilakukan pemeriksaan secara ilmiah oleh Balai Laboratorium Narkoba BNN terkait kandungan permen,"" kata Kepala Bagian Humas BNN Slamet Pribadi lewat pesan singkat, Rabu (8/3/2017). Slamet menyebutkan, BNN mengimbau agar masyarakat bersabar menunggu hasil pemeriksaan tersebut. ""Diharapkan para orang tua dan anak-anak tetap waspada terhadap segala macam bentuk dan jenis Narkoba dengan tidak mengonsumsi makanan, minuman, maupun obat-obatan yang tidak memiliki izin edar,"" kata Slamet",Valid,"Badan Narkotika Nasional (BNN) mengimbau warga untuk mewaspadai peredaran permen berbentuk dot di Surabaya, Jawa Timur yang diduga mengandung narkoba atau bahan berbahaya lain."
"Para orangtua perlu waspada. Peredaran narkoba mulai menyasar anak  anak. Modus digunakan para pelaku dengan mencampurkan narkoba dalam permen dot. Dinas Perdagangan menelusuri toko, pasar tradisional dan sekolah untuk memastikan Mataram bebas dari permen dot tersebut.
 
Kepala Dinas Perdagangan Kota Mataram, L. Alwan Basri mengatakan, persoalan ini harus dilihat dan dicermati terlebih dahulu di lapangan. Karena, ini menyangkut khalayak ramai khususnya anak  anak yang perlu dilindungi.

Modus mafia narkoba dinilai sangat membahayakan generasi muda. Ia meminta Bidang Pengawasan Dinas Perdagangan menindaklanjuti dengan menelusuri titik  titik pusat perbelanjaan, pasar, kios dan kantin sekolah.

Nanti bidang pengawasan dan kepala pasar saya suruh cek, kata Alwan, Rabu, 8 Maret 2017. Penelusuran akan melibatkan Balai Besar Pengawasan Obat dan Makanan, Satpol PP dan aparat kepolisian. Jika barang itu ditemukan beredar di Kota Mataram. Pihaknya akan langsung menarik dan mengamankan untuk dilakukan tes laboratorium. Kalau ditemukan langsung kita sita dan tarik, tegasnya.

Indikasi itu tidak sampai di situ saja. Aparat Kepolisian akan diminta menelusuri sumbernya. Pengecer maupun pedagang akan diperiksa mencari tahu mata rantai pemasaran. Pemerintah tak ingin obat  obatan terlarang merambah pelajar. Mantan Kabag Humas dan Protokoler Setda Kota Mataram menegaskan, bila perlu pelaku dipidanakan sesuai ketentuan hukum yang berlaku.

Pasti ada mata rantainya. Ini yang akan kita cari tahu, ujarnya. Bukan hanya permen dot, tapi produk lain yang mengandung zat berbahaya rutin dilakukan pengawasan. Walikota dan Wakil Walikota Mataram tetap mengimbau masyarakat agar menghindari bahan berbahaya. Khusus bagi orangtua agar membekali anak  anaknya makanan yang dimasak di rumah. Jangan sampai berbelanja di luar apalagi higenisitas tidak jelas, pesannya.",Valid,Para orangtua perlu waspada.
"Produk permen berbentuk dot telah mengantongi izin produksi dari Badan Pengawas Obat dan Makanan (BPOM). Ya, benar (sudah mengantongi izin), kata Kepala Pusat Penyidikan Obat dan Makanan BPOM Hendri Siswadi, saat dihubungi di Jakarta, Kamis, 9 Maret 2017. 

Permen berbentuk dot yang diduga mengandung narkoba tersebut ditemukan di Surabaya, Jawa Timur. BPOM Surabaya tengah memeriksa kandungan permen yang diduga mengandung narkoba. Namun, hasil sementara, kata Hendri, kandungan bahan berbahaya belum ditemukan. Sampai hari ini, BPOM Surabaya sudah menguji menggunakan 16 parameter dengan hasil negatif.

Temuan permen diduga mengandung narkoba itu bermula dari operasi rutin Satuan Polisi Pamong Praja saat merazia pelajar yang membolos saat jam sekolah di Surabaya. Salah satunya di warung Internet yang biasa dijadikan tempat nongkrong siswa ketika membolos. 

Dalam operasi itu tim menemukan seorang siswa SD yang merasa pusing setelah mengkonsumsi permen. Kepala Satuan Polisi Pamong Praja Irvan Widianto mengatakan ada beberapa bentuk permen narkoba berbentuk dot bayi bermerek Permen Keras dan tongkat jeli.",Valid,Produk permen berbentuk dot telah mengantongi izin produksi dari Badan Pengawas Obat dan Makanan (BPOM).
"Badan Narkotika Nasional (BNN) Kota Surabaya meminta kepada masyarakat tidak panik soal permen dot.

Permen yang diduga mengandung bahan berbahaya dan narkoba itu, kini banyak dirazia Pemkot Surabaya.

Ketua BNN Kota Surabaya AKBP Suparti meminta, masyarakat tidak keburu resah soal permen dot.

""Kami meminta masyarakat tidak perlu panik. Kami akan melakukan uji leb dulu permen dot itu,"" sebut Suparti, Selasa (7/3/2017).

Suparti menuturkan, sampai saat ini belum ada bukti permen tersebut berbahaya atau mengandung zat-zat narkotika.

""Kan belum ada uji lab, jadi belum bisa ditentukan permen itu berbahaya atau tidak,"" terang Suparti.

Mantan Kasubbag Humas Polrestabes Surabaya ini menuturkan, pihaknya juga sudah mengambil sampel permen dot di berbagai tempat. Seperti warung, toko, dan beberapa pasar.

""Kami turun dan mengambil permen dot. Nanti akan dilakukan uji lab untuk menentukan apakah berbahaya atau ada kandungan narkotikanya,"" cetus Suparti.

Ia menegaskan, pihaknya secepatnya akan melakukan uji lab terhadap permen tersebut.",Valid,"Badan Narkotika Nasional (BNN) Kota Surabaya meminta kepada masyarakat tidak panik soal permen dot.

"
"Medan  13/02/2017, Menanggapi berita di beberapa media cetak maupun online tentang beredarnya Permen Dot yang diduga mengandung narkoba dan bahan bahaya lainnya yang pertama kali ditemukan di Surabaya  Jawa Timur  sehingga membuat resah masyarakat terutama yang mempunyai anak kecil. 
 
Menyikapi hal tersebut BB Pom Medan bekerjasama dengan BNN Sumut dan Dinas Kesehatan Kabupaten / Kota melakukan pengawasan kelapangan dan dari hasil pengawasan bahwa bonbon dot itu sudah beredar dibeberapa daerah / kabupaten di wilayah Sumatera Utara.
 
Labfor Cabang Medan sudah melakukan pemeriksaan dengan mengambil sampel dari Langkat yang terdiri dari BB 1 : Permen Spray, BB2 : Permen Dot dan BB3 : Serbuk Putih, setelah diperiksa dengan instrumen GCMS dan FTIR diperoleh hasil negative narkotika dan psikotropika dan setelah terdeteksi bahwa bonbon tersebut mengandung D-Glukosa Monohydrate, Glukopur, Sweetener, D-Glukosa, DL-Phenylalanie, Methy Ester, Methyl Stearat, Asam Palmitat dan menurut dari Labfor Cabang Medan bahwa seluruh zat yang terdeteksi didalam bonbon tersebut umumnya digunakan sebagai pemanis bukan termasuk dalam jenis narkotika / psikotropika.
 
Dengan adanya hasil dari Laboratorium Labfor Cabang Medan di himbau kepada masyarakat tidak perlu panik namun agar masyarakat lebih bijak dalam mengkomsumsi produk pangan yang memiliki izin edar, dan melihat tanggal kadarluasa sehingga tidak menimbulkan kesehatan.",Hoax,"Medan  13/02/2017, Menanggapi berita di beberapa media cetak maupun online tentang beredarnya Permen Dot yang diduga mengandung narkoba dan bahan bahaya lainnya yang pertama kali ditemukan di Surabaya  Jawa Timur  sehingga membuat resah masyarakat terutama yang mempunyai anak kecil. 
 
"
"Pemkot Surabaya terus merazia permen dot yang terindikasi mengandung narkoba. Razia permen berkemasan warna hijau menyasar tiga kecamatan, yaitu Kecamatan Genteng, Kecamatan Rungkut, dan Kecamatan Sawahan.

Camat Sawahan, Kota Surabaya, Yunus mengatakan razia sudah dilakukan ke tiga sekolah.

Kami razia di SDN Pakis I, SDN Pakis II, dan SDN Pakis IX di Jalan Pakistirtosari. Hasilnya ada 20 biji permen dot, ucap Yunus, Selasa (7/3/2017).

Permen dot tersebut disinyalir mengandung narkoba. Secara fisik, permen tersebut tidak terlihat seperti narkoba, melainkan seperti permen biasa.

Permen ini dijual PKL di sekitar sekolah, dan langsung disita. Kami sita, dan dibawa ke kantor kecamatan, ucap Yunus.

Petugas yang merazia makanan dan minuman di sejumlah SD di Sawahan itu juga menemukan sejumlah permen keras. Permen ini diduga mengandung formalin yang berbahaya jika dikonsumsi anak.

Untuk permen keras ada 33 biji dan 17 pak permen keras yang bentuknya tablet. Kami juga sita itu, kata Yunus.
",Hoax,Pemkot Surabaya terus merazia permen dot yang terindikasi mengandung narkoba.
"BEKASI, Maraknya permen dot yang diduga berisi kandungan narkoba disejumlah daerah, ternyata beredar juga di Kabupaten Bekasi. Khususnya di sejumlah sekolah yang berada di wilayah Babelan. Di wilayah ini, permen yang dikemas seperti dot bayi ditemukan dan dijual oleh seorang pedagang dengan harga Rp 1000 per biji. Hal ini diakui oleh pedagang permen dot bernama Zainal Arifin (38). Menurut dia, dirinya awalnya tidak sama sekali mengetahui jika permen yang dijualnya mengandung narkoba. Ya awalnya enggak tau, saya sih jual saja karena banyak disukai pelajar permennya, kata Zainal Arifin, Rabu (8/3/2017). Lebih lanjut, kata Zainal, belakangan setelah mendengar kabar permen yang dijualnya itu mengandung narkoba. Dirinya pun mengakui, langsung berhenti menjual permen tersebut. Iya sekarang pas tau udah enggak jual mas. Meskipun masih banyak anak-anak yang mencari permen tersebut, ujar Zainal. Adapun alasan Zainal tak lagi menjual permen dot itu, diakui Zainal, dirinya takut ada kesalahan dari penjualan permen dot tersebut. Hingga akhirnya, dia pun benar-benar tidak menjual lagi. Sejauh ini, kata Zainal, setiap permen yang dijual sebesar Rp 1000 per satu permennya. Selama menjual permen itu, dalam sehari laku dibawah 10 permen.",Hoax,"BEKASI , Maraknya permen dot yang diduga berisi kandungan narkoba disejumlah daerah , ternyata beredar juga di Kabupaten Bekasi ."
"Terkait adanya temuan jajanan permen yang mengandung narkoba membuat sejumlah kalangan khawatir, seperti halnya kalangan legislatif Pekanbaru. Dewan meminta pihak Kepolisian, Disperindag, BPOM dan intansi terkait lainnya segera bertindak dan turun ke lapangan guna memastikan jajanan anak yang diduga mengandung narkoba tersebut tidak beredar di Kota Pekanbaru.
 
""Ini yang membuat kita dan masyarakat khawatir, jadi ya harus diantisipasi secepatnya, jangan sampai masuk ke daerah kita. Untuk itu pihak kepolisian sudah bisa bergerak turun ke lapangan memastikan permen dot yang diduga mengandung narkoba tidak beredar di Pekanbaru, telusuri setiap pedagang maupun produsen,"" kata Anggota Komisi II DPRD Kota Pekanbaru, Roem Diani Dewi, Jumat (10/3).
 
Politisi PKS ini menyebutkan, jika kasus permen yang terindikasi mengandung narkoba ini benar adanya, maka pihak kepolisian diminta bisa bersikap tegas dan menegakkan aturan yang ada. ""Jangan sampai barang sudah beredar baru ditindak, karea di beberapa warung sepertinya sudah beredar, dan itu kita lihat sendiri,"" kata Roem.
 
Selain itu kata Roem, kalau memang itu terbukti benar ada dan positif mengandung narkoba, pihak penegak hukum diminta bisa bersikap tegas dan memberikan hukuman setimpal kepada pengedar atau pemasok makanan tersebut.
 
""Pelaku tindak kejahatan ini yang perlu ditindak. Jelas ini merusak generasi bangsa dengan memasukkan zat-zat berbahaya ke dalam jajanan, apalagi untuk anak-anak,"" tegas Roem.
 
Lebih jauh Roem juga berharap, sebagai bentuk antisipasi, pihak pemerintah baik itu BPOM, Diskes dan pihak sekolah perlu bekerja sama melakukan sosialisasi kepada siswa tentang bahaya narkoba.
 
""Kita berharap para siswa diberi pemahaman tentang bahaya narkoba ini, apalagi jika dikemas dalam bentuk semenarik mungkin seperti dugaan permen dot mengandung narkoba itu, kan sangat susah sekali dikenali oleh masyarakat apalagi anak-anak. Saya kira pihak sekolah juga berperan dan tidak boleh membiarkan pedagang berkeliaran di luar sekolah yang jajanananya belum terjamin kesehatan dan keamanannya,"" jelas Roem.
 
Temuan permen dot yang diduga mengandung narkoba dikabarkan sedang marak diperjualbelikan di sejumlah sekolah dasar dan taman kanak-kanak (TK) di Kota Surabaya, bahkan guna memastikan perihal kasus itu, pemerintah Surabaya Jawa Timur bersama pihak terkait lainnya seperti pihak BPOM dikabarkan sedang melakukan penyelidikan.",Hoax,"Terkait adanya temuan jajanan permen yang mengandung narkoba membuat sejumlah kalangan khawatir, seperti halnya kalangan legislatif Pekanbaru."
"Razia terhadap permen dot yang diduga mengandung narkoba juga dilakukan di Kabupaten Bangkalan. Dalam razia yang digelar petugas gabungan dari Polres Bangkalan, Satpol PP, dan Dinkes Bangkalan ini ribuan botol permen dot diamankan dari sejumlah toko. Sasaran razia tersebut tidak hanya toko-toko besar. Sejumlah pedagang asongan yang berjualan di sekolah dasar (SD) juga tidak luput dari operasi serentak di sejumlah wilayah Bangkalan itu. Bahkan petugas gabungan menemukan agen permen yang disinyalir mengandung bahan terlarang itu. Jumlah total keseluruhan permen yang disita mencapai 1.530 botol. Semua barang bukti tersebut diamankan di Mapolres dan akan diuji di labfor untuk mengetahui kandungan zat di dalamnya. Razia ini tidak hanya di kota. Tapi kami sebar ke sejumlah wilayah seperti di Tanah Merah, Kamal dan Sukolilo, jelas Kabag Ops Polres Bangkalan, Kompol Agung Setyono, Rabu (8/7/2017). Langkah berikutnya kata Agung, menunggu hasil pemeriksaan dan penelitian kandungan permen tersebut. Jika memang terbukti mengandung obat terlarang para penjual permen tersebut akan dipanggil untuk dimintai keterangan. Tapi, apabila tidak mengandung zat berbahaya akan dikembalikan. Permen ini sudah menyebar dimana-mana. Tentunya menjadi perhatian bagi orang tua agar mengawasi anak-anaknya ketika membeli makanan apapun, imbuhnya. Sementara itu, Kepala Bidang Kesehatan Dinkes Bangkalan, Ciptaning Tekad menambahkan minimal permen tersebut diamankan terlebih dahulu dan menunggu hasil penelitian dari Balai Besar Pengawas Obat dan Makanan (BBPOM) Surabaya. Kalau dilihat dari kode ML ini barang impor. Kalau MD produk dalam negeri. Tapi keterangannya berbahasa Indonesia semua. Apa ini palsu atau tidak kita tunggu hasil pemeriksaan, jelasnnya.",Hoax,Razia terhadap permen dot yang diduga mengandung narkoba juga dilakukan di Kabupaten Bangkalan.
